{
  "repository": "owner/repository",
  "change_contract_hash": "sha256:aaaaaaaaaaaaaaaaaaaaaaaaaaaaaaaaaaaaaaaaaaaaaaaaaaaaaaaaaaaaaaaa",
  "head_sha": "1111111111111111111111111111111111111111",
  "policy_bundle_hash": "sha256:bbbbbbbbbbbbbbbbbbbbbbbbbbbbbbbbbbbbbbbbbbbbbbbbbbbbbbbbbbbbbbbb",
  "base_sha": "0000000000000000000000000000000000000000",
  "toolchain_hash": "sha256:cccccccccccccccccccccccccccccccccccccccccccccccccccccccccccccccc"
}
